{
  "run_name": "live-round-2026-05-13-digital-offers-with-meta-ads",
  "notes": "Rodada de iniciacao do agente com foco em entregas digitais escalaveis. Inclui hipoteses, evidencias publicas e links para verificacao na Meta Ads Library.",
  "opportunity_hypotheses": [
    {
      "cluster_key": "ai-search-geo-audit",
      "title": "Auditoria GEO/AI Search para Sites que Perderam Trafego Organico",
      "solution_type": "audit",
      "offer_type": "auditoria digital / relatorio / micro-saas futuro",
      "audience": "SaaS pequenos, agencias, blogs monetizados, creators com site e negocios digitais dependentes de SEO",
      "promise": "Veja se seu site esta invisivel no ChatGPT, Gemini, Perplexity e AI Overviews, e receba um plano de correcao.",
      "why_now": "AI Overviews e respostas de LLMs estao mudando CTR organico; ja existem produtos vendendo AI Search Optimization.",
      "mvp_hours": 48,
      "delivery_manual_possible": true,
      "meta_ads_fit": 78,
      "mvp": [
        "Formulario com dominio, nicho, concorrentes e 10 consultas-alvo",
        "Teste manual/assistido em buscadores IA e SERP para checar citacoes e gaps",
        "Relatorio PDF com score de visibilidade IA, schema/checklist e plano de 7 dias"
      ],
      "meta_ads_test": {
        "budget": "R$500-R$1000",
        "creatives": 4,
        "objective": "Lead magnet + venda de auditoria R$97-R$297",
        "kill_rule": "Matar se os leads nao tiverem site ativo ou trafego organico relevante",
        "scale_rule": "Continuar se gerar leads de agencias/SaaS ou vender 2 auditorias"
      },
      "red_team": [
        "Termo GEO ainda exige educacao do mercado",
        "Dificil prometer recuperacao de trafego; vender visibilidade e plano de acao",
        "Precisa pedir dados do Search Console para validar dor real"
      ],
      "next_actions": [
        "Verificar Meta Ads Library: https://www.facebook.com/ads/library/?active_status=active&ad_type=all&country=BR&q=SEO%20IA",
        "Criar diagnostico gratuito: 'Seu site aparece nas respostas das IAs?'",
        "Montar checklist de schema, entidades, paginas comerciais e mencoes externas"
      ],
      "tags": [
        "digital_delivery",
        "seo",
        "ai_search",
        "geo",
        "b2b",
        "agency",
        "smb",
        "direct_response"
      ]
    },
    {
      "cluster_key": "meta-ads-offer-diagnostic",
      "title": "Diagnostico Digital de Oferta e Meta Ads para Pequenos Anunciantes",
      "solution_type": "audit",
      "offer_type": "auditoria digital / servico productizado",
      "audience": "donos de pequenos negocios digitais, creators, infoprodutores, SaaS pequenos e ecommerce digital que anunciam no Meta",
      "promise": "Descubra em 24h por que seus anuncios recebem cliques mas nao geram venda, com um plano de correcao priorizado.",
      "why_now": "Pequenos anunciantes reclamam de verba queimada, baixa conversao e confusao entre criativo, tracking, oferta e landing page.",
      "mvp_hours": 24,
      "delivery_manual_possible": true,
      "meta_ads_fit": 92,
      "mvp": [
        "Formulario com URL da landing, prints/CSV do gerenciador e descricao da oferta",
        "Checklist de 37 pontos: criativo, hook, oferta, tracking, evento, pagina e checkout",
        "Relatorio PDF + Loom curto com 3 mudancas prioritarias"
      ],
      "meta_ads_test": {
        "budget": "R$300-R$700",
        "creatives": 5,
        "objective": "Lead ou venda direta de auditoria R$47-R$197",
        "kill_rule": "Matar se CPC ficar alto e nenhum lead qualificado aparecer apos R$150-R$250",
        "scale_rule": "Continuar se gerar 5+ leads qualificados ou 1 venda com CPA aceitavel"
      },
      "red_team": [
        "Pode virar consultoria trabalhosa se nao limitar escopo",
        "Precisa prometer diagnostico, nao resultado garantido",
        "Prova real so vem com venda/lead e qualidade dos dados enviados"
      ],
      "next_actions": [
        "Verificar Meta Ads Library: https://www.facebook.com/ads/library/?active_status=active&ad_type=all&country=BR&q=gestao%20de%20trafego",
        "Criar LP com headline de perda de verba",
        "Vender primeiro como auditoria manual antes de automatizar"
      ],
      "tags": [
        "digital_delivery",
        "meta_ads",
        "paid_traffic",
        "direct_response",
        "b2b",
        "smb",
        "creator"
      ]
    },
    {
      "cluster_key": "whatsapp-ai-lead-qualification",
      "title": "Agente Digital de Qualificacao de Leads WhatsApp para Negocios de Servico",
      "solution_type": "automation",
      "offer_type": "automacao / agente / servico productizado digital",
      "audience": "negocios de servico, agencias, clinicas, consultores, escolas livres e prestadores que recebem leads pelo WhatsApp",
      "promise": "Transforme conversas baguncadas do WhatsApp em lead qualificado, resumo, proximo passo e resposta pronta.",
      "why_now": "WhatsApp segue como canal central de venda no Brasil; pequenos negocios querem responder rapido sem montar atendimento complexo.",
      "mvp_hours": 72,
      "delivery_manual_possible": true,
      "meta_ads_fit": 84,
      "mvp": [
        "Formulario onde o cliente cola conversa ou exporta texto do WhatsApp",
        "IA classifica lead, urgencia, objeções e proximo passo",
        "Entrega resposta pronta + resumo CRM em PDF/planilha"
      ],
      "meta_ads_test": {
        "budget": "R$400-R$900",
        "creatives": 5,
        "objective": "Lead para diagnostico ou venda de setup R$197-R$497",
        "kill_rule": "Matar se leads nao usam WhatsApp como canal comercial",
        "scale_rule": "Continuar se gerar calls/diagnosticos com negocios que recebem 20+ conversas por semana"
      },
      "red_team": [
        "Automacao completa via WhatsApp API pode ter friccao; comecar por entrega semi-manual",
        "Mercado cheio de chatbot generico; precisa verticalizar por dor de lead perdido",
        "Nao prometer integracao oficial na V0"
      ],
      "next_actions": [
        "Verificar Meta Ads Library: https://www.facebook.com/ads/library/?active_status=active&ad_type=all&country=BR&q=chatbot%20whatsapp",
        "Criar teste: 'Quantos leads do WhatsApp voce perdeu esta semana?'",
        "Criar template de resumo + resposta pronta por nicho"
      ],
      "tags": [
        "digital_delivery",
        "whatsapp",
        "ai_agent",
        "lead_qualification",
        "smb",
        "b2b",
        "direct_response",
        "meta_ads"
      ]
    },
    {
      "cluster_key": "ugc-creative-fatigue-pack",
      "title": "Pacote Digital de Hooks e Criativos UGC para Meta Ads com Fadiga",
      "solution_type": "template",
      "offer_type": "template / auditoria criativa / pacote de prompts e roteiros",
      "audience": "infoprodutores, creators, SaaS pequenos, agencias e anunciantes que precisam renovar criativos toda semana",
      "promise": "Receba 30 hooks, 10 roteiros UGC e uma matriz de testes para parar a fadiga criativa nos seus anuncios.",
      "why_now": "Discussões recentes sobre Meta Ads mostram fadiga criativa, necessidade de hooks melhores e aumento da importancia de criativos.",
      "mvp_hours": 24,
      "delivery_manual_possible": true,
      "meta_ads_fit": 95,
      "mvp": [
        "Formulario com oferta, avatar, dores e criativos atuais",
        "Gerador manual/IA de 30 hooks + 10 roteiros UGC",
        "Matriz de teste A/B por angulo, dor, prova e CTA"
      ],
      "meta_ads_test": {
        "budget": "R$300-R$700",
        "creatives": 6,
        "objective": "Venda direta R$47-R$147 ou lead para pacote personalizado",
        "kill_rule": "Matar se clientes pedirem criacao audiovisual completa e nao roteiro/template",
        "scale_rule": "Continuar se vender pacotes para anunciantes ativos ou agencias"
      },
      "red_team": [
        "Pode virar commodity se for so prompts genericos",
        "Precisa usar exemplos da oferta do cliente para parecer personalizado",
        "Nao prometer performance, vender volume de hipoteses criativas"
      ],
      "next_actions": [
        "Verificar Meta Ads Library: https://www.facebook.com/ads/library/?active_status=active&ad_type=all&country=BR&q=criativos%20para%20anuncios",
        "Criar LP: 'Seu anuncio morreu? gere a proxima bateria de criativos em 24h'",
        "Criar amostra gratuita com 5 hooks"
      ],
      "tags": [
        "digital_delivery",
        "ugc",
        "creative",
        "meta_ads",
        "paid_traffic",
        "direct_response",
        "creator",
        "agency"
      ]
    },
    {
      "cluster_key": "n8n-automation-template-packs",
      "title": "Packs Digitais de Automacoes n8n para Processos Comerciais",
      "solution_type": "automation",
      "offer_type": "template / automacao / servico productizado digital",
      "audience": "agencias, freelancers, solopreneurs e pequenos negocios que querem automatizar tarefas repetitivas sem contratar dev full-time",
      "promise": "Instale automacoes prontas de lead, proposta, follow-up, relatorio e CRM em horas, nao semanas.",
      "why_now": "n8n e automacoes com IA estao populares; usuarios procuram templates e exemplos para transformar workflows em produto.",
      "mvp_hours": 72,
      "delivery_manual_possible": true,
      "meta_ads_fit": 76,
      "mvp": [
        "3 workflows n8n exportaveis: captura lead, follow-up e relatorio",
        "Guia PDF de instalacao + video curto",
        "Setup assistido pago para os primeiros clientes"
      ],
      "meta_ads_test": {
        "budget": "R$400-R$800",
        "creatives": 4,
        "objective": "Lead ou venda de pack R$97-R$297",